{
  "schema": "atlas.census-certificate.v2",
  "certificate_id": "census-certificate:403291e58efcc2de5260039499da198d4b3d3930e1b9d8924b6a18dbd7276234",
  "state": "RECONCILED",
  "corpus": {
    "corpus_id": "llgtrn/Atlas-Studio",
    "root_hash": "blake3-256:d31a42816cdbb88d1c8d827afe5676c2fd334cda0f289e5e10f7f0e77520d9af",
    "revisions": {
      "llgtrn/Atlas-Studio": "9f3cf8f56287b7594865db14c3f008a638f83824"
    }
  },
  "genome": {
    "schema": "atlas.genome.v1",
    "hash": "blake3-256:e076b0d870969819e6606ab8b3ac21b035635e3d650f2dbcf1989ea2f2c8e4f9"
  },
  "inventory": {
    "artifacts_total": 148,
    "artifacts_accounted_total": 148,
    "closed": true,
    "dispositions": {
      "IGNORED_BY_EXPLICIT_POLICY": 3,
      "PARSED": 145
    }
  },
  "dependency": {
    "contexts_total": 1,
    "nodes_total": 39,
    "edges_total": 64,
    "source_backed_total": 4,
    "source_censused_total": 4,
    "terminal_boundary_total": 32,
    "unresolved_total": 0,
    "fixed_point_converged": true,
    "closed": true,
    "root_hash": "blake3-256:4a21ecbb77bb24c35e7363134d4d1d9d31635707f52bc64f2e0da589dbfe67e4"
  },
  "semantic": {
    "facts_total": 27504,
    "obligations_total": 2365,
    "obligations_accounted_total": 2365,
    "coverage": {
      "BUILD": "OBSERVED",
      "CALL": "UNKNOWN",
      "CONCURRENCY": "UNKNOWN",
      "CONTROL_FLOW": "UNKNOWN",
      "DATA_FLOW": "UNKNOWN",
      "DECLARED_ADL": "DECLARED",
      "EFFECT": "UNKNOWN",
      "FUNCTION_IDENTITY": "OBSERVED",
      "FUNCTION_SIGNATURE": "OBSERVED",
      "OWNERSHIP": "UNKNOWN",
      "PERSISTENCE": "UNKNOWN",
      "SOURCE_ARTIFACT": "OBSERVED",
      "STATE": "UNKNOWN",
      "SYMBOL": "OBSERVED",
      "TYPE": "OBSERVED"
    },
    "unknown_total": 1548,
    "unsupported_total": 228,
    "ignored_total": 3,
    "conflict_total": 0,
    "dynamic_edges_total": 9,
    "binding_gaps_total": 1
  },
  "normalization": {
    "input_records_total": 27504,
    "normalized_records_total": 27504,
    "exact_duplicates_merged": 0,
    "equivalence_classes_total": 27504,
    "conflict_candidates_total": 0,
    "provenance_complete": true,
    "root_hash": "blake3-256:90fd1f5b0edc825305da04ced6473635fcb4383bcc6e8e9e8d9524da0d177388"
  },
  "reconciliation": {
    "complete": true,
    "unresolved_conflicts_total": 0
  },
  "fixed_point": {
    "iterations": 2,
    "converged": true,
    "delta_at_exit": 0
  },
  "independent_passes": {
    "passes_total": 2,
    "agreement": "PARTIAL",
    "conflicts_total": 0
  },
  "evidence": {
    "root_hash": "blake3-256:25a4a4aec8eaaf06f6ec29fabb81347267f1c8102c1f1186a8a85ec11a3280d7",
    "provenance_complete": true
  },
  "atlas": {
    "root_hash": "blake3-256:75d570bda5bc2aef39f1255e86c27c23e97f3daa736b9b00aca8bf6af47ac674"
  },
  "blockers": [
    "ATLAS_ROOT_UNSEALED: the packaged .atlas is an unsealed census container (no seal gate exists)",
    "COVERAGE_UNKNOWN: CALL",
    "COVERAGE_UNKNOWN: CONCURRENCY",
    "COVERAGE_UNKNOWN: CONTROL_FLOW",
    "COVERAGE_UNKNOWN: DATA_FLOW",
    "COVERAGE_UNKNOWN: EFFECT",
    "COVERAGE_UNKNOWN: OWNERSHIP",
    "COVERAGE_UNKNOWN: PERSISTENCE",
    "COVERAGE_UNKNOWN: STATE",
    "DYNAMIC_DEPENDENCY_OBLIGATIONS: 9",
    "MULTI_ENGINE_RECONCILIATION_ABSENT: one engine for CONTROL_FLOW, DATA_FLOW, FUNCTION_IDENTITY, FUNCTION_SIGNATURE, OWNERSHIP, STATE, SYMBOL (Genome: multi_engine_reconciliation_required)",
    "UNKNOWN_FACTS: 1548",
    "UNSUPPORTED_FACTS: 228"
  ]
}
