{
  "schema": "atlas.census-certificate.v2",
  "certificate_id": "census-certificate:21b6a9e67dfc1cb24b873bbf00db5fb906cdcf38ba9378394e06f1fca5da8d14",
  "state": "RECONCILED",
  "corpus": {
    "corpus_id": "llgtrn/Atlas-Studio",
    "root_hash": "blake3-256:fd613ee6fafe6d306d1ce8d8179f0a8ae8705299534f12e87e786e7aab42b58d",
    "revisions": {
      "llgtrn/Atlas-Studio": "f5aaff6e5b4710d2150f94578a189f839278f8bf"
    }
  },
  "genome": {
    "schema": "atlas.genome.v1",
    "hash": "blake3-256:e076b0d870969819e6606ab8b3ac21b035635e3d650f2dbcf1989ea2f2c8e4f9"
  },
  "inventory": {
    "artifacts_total": 119,
    "artifacts_accounted_total": 119,
    "closed": true,
    "dispositions": {
      "IGNORED_BY_EXPLICIT_POLICY": 2,
      "PARSED": 117
    }
  },
  "dependency": {
    "contexts_total": 1,
    "nodes_total": 27,
    "edges_total": 39,
    "source_backed_total": 4,
    "source_censused_total": 4,
    "terminal_boundary_total": 20,
    "unresolved_total": 0,
    "fixed_point_converged": true,
    "closed": true,
    "root_hash": "blake3-256:5d9cbb00180673c03088c4e705db56aff05aa40c56845265d77ea31c00392742"
  },
  "semantic": {
    "facts_total": 15791,
    "obligations_total": 1796,
    "obligations_accounted_total": 1796,
    "coverage": {
      "BUILD": "OBSERVED",
      "CALL": "UNKNOWN",
      "CONCURRENCY": "UNKNOWN",
      "CONTROL_FLOW": "UNKNOWN",
      "DATA_FLOW": "UNKNOWN",
      "DECLARED_ADL": "DECLARED",
      "EFFECT": "UNKNOWN",
      "FUNCTION_IDENTITY": "OBSERVED",
      "FUNCTION_SIGNATURE": "OBSERVED",
      "OWNERSHIP": "UNKNOWN",
      "PERSISTENCE": "UNKNOWN",
      "SOURCE_ARTIFACT": "OBSERVED",
      "STATE": "UNKNOWN",
      "SYMBOL": "OBSERVED",
      "TYPE": "OBSERVED"
    },
    "unknown_total": 1101,
    "unsupported_total": 228,
    "ignored_total": 2,
    "conflict_total": 0,
    "dynamic_edges_total": 9,
    "binding_gaps_total": 1
  },
  "normalization": {
    "input_records_total": 15791,
    "normalized_records_total": 15791,
    "exact_duplicates_merged": 0,
    "equivalence_classes_total": 15791,
    "conflict_candidates_total": 0,
    "provenance_complete": true,
    "root_hash": "blake3-256:20b2e23737f92da5d17e440d08a863904b204b9338e531209e01c60bdb03b34e"
  },
  "reconciliation": {
    "complete": true,
    "unresolved_conflicts_total": 0
  },
  "fixed_point": {
    "iterations": 2,
    "converged": true,
    "delta_at_exit": 0
  },
  "independent_passes": {
    "passes_total": 2,
    "agreement": "PARTIAL",
    "conflicts_total": 0
  },
  "evidence": {
    "root_hash": "blake3-256:4b3ee57d122a40e5c46fe636bde0d68394bf01ba2c5c4e5a497926b55bbfeeba",
    "provenance_complete": true
  },
  "atlas": {
    "root_hash": "blake3-256:189a46c27be213b52c502a2b26bdd2052c9903a02891f165d28a7624b9b74817"
  },
  "blockers": [
    "ATLAS_ROOT_UNSEALED: the packaged .atlas is an unsealed census container (no seal gate exists)",
    "COVERAGE_UNKNOWN: CALL",
    "COVERAGE_UNKNOWN: CONCURRENCY",
    "COVERAGE_UNKNOWN: CONTROL_FLOW",
    "COVERAGE_UNKNOWN: DATA_FLOW",
    "COVERAGE_UNKNOWN: EFFECT",
    "COVERAGE_UNKNOWN: OWNERSHIP",
    "COVERAGE_UNKNOWN: PERSISTENCE",
    "COVERAGE_UNKNOWN: STATE",
    "DYNAMIC_DEPENDENCY_OBLIGATIONS: 9",
    "MULTI_ENGINE_RECONCILIATION_ABSENT: one engine for CONTROL_FLOW, DATA_FLOW, FUNCTION_IDENTITY, FUNCTION_SIGNATURE, OWNERSHIP, PERSISTENCE, STATE, SYMBOL (Genome: multi_engine_reconciliation_required)",
    "REVISION_DIRTY: the census input is not a pinned commit",
    "UNKNOWN_FACTS: 1101",
    "UNSUPPORTED_FACTS: 228"
  ]
}
