{
  "schema": "atlas.census-certificate.v2",
  "certificate_id": "census-certificate:c919fab46102115ced2aa6be415ab502c8ba0067399c215d610de131873e1106",
  "state": "RECONCILED",
  "corpus": {
    "corpus_id": "llgtrn/Atlas-Studio",
    "root_hash": "blake3-256:c4c243c9a80a627f44a92754527947e15c1a7392c2a91db8b27cffee3ae40b90",
    "revisions": {
      "llgtrn/Atlas-Studio": "b0a8d9cdf9cfb5bf700528b83f8d7c4e806a14c5"
    }
  },
  "genome": {
    "schema": "atlas.genome.v1",
    "hash": "blake3-256:e076b0d870969819e6606ab8b3ac21b035635e3d650f2dbcf1989ea2f2c8e4f9"
  },
  "inventory": {
    "artifacts_total": 110,
    "artifacts_accounted_total": 110,
    "closed": true,
    "dispositions": {
      "IGNORED_BY_EXPLICIT_POLICY": 2,
      "PARSED": 108
    }
  },
  "dependency": {
    "contexts_total": 1,
    "nodes_total": 27,
    "edges_total": 39,
    "source_backed_total": 4,
    "source_censused_total": 4,
    "terminal_boundary_total": 20,
    "unresolved_total": 0,
    "fixed_point_converged": true,
    "closed": true,
    "root_hash": "blake3-256:5d9cbb00180673c03088c4e705db56aff05aa40c56845265d77ea31c00392742"
  },
  "semantic": {
    "facts_total": 11903,
    "obligations_total": 1296,
    "obligations_accounted_total": 1296,
    "coverage": {
      "BUILD": "OBSERVED",
      "CALL": "UNKNOWN",
      "CONCURRENCY": "UNKNOWN",
      "CONTROL_FLOW": "UNKNOWN",
      "DATA_FLOW": "UNKNOWN",
      "DECLARED_ADL": "DECLARED",
      "EFFECT": "UNKNOWN",
      "FUNCTION_IDENTITY": "OBSERVED",
      "FUNCTION_SIGNATURE": "OBSERVED",
      "OWNERSHIP": "UNKNOWN",
      "PERSISTENCE": "UNKNOWN",
      "SOURCE_ARTIFACT": "OBSERVED",
      "STATE": "UNKNOWN",
      "SYMBOL": "OBSERVED",
      "TYPE": "OBSERVED"
    },
    "unknown_total": 712,
    "unsupported_total": 228,
    "ignored_total": 2,
    "conflict_total": 0,
    "dynamic_edges_total": 9,
    "binding_gaps_total": 1
  },
  "normalization": {
    "input_records_total": 11903,
    "normalized_records_total": 11903,
    "exact_duplicates_merged": 0,
    "equivalence_classes_total": 11903,
    "conflict_candidates_total": 0,
    "provenance_complete": true,
    "root_hash": "blake3-256:f139e899894743b1def3d1c67acaa900dd08fc13f9b6e7ce7dc313fce2b5b723"
  },
  "reconciliation": {
    "complete": true,
    "unresolved_conflicts_total": 0
  },
  "fixed_point": {
    "iterations": 2,
    "converged": true,
    "delta_at_exit": 0
  },
  "independent_passes": {
    "passes_total": 1,
    "agreement": "NOT_APPLICABLE",
    "conflicts_total": 0
  },
  "evidence": {
    "root_hash": "blake3-256:d5aa1f87c793642877fe0b8073829ac2e6f12b2ff73cff8c5d58dfbb29eb6336",
    "provenance_complete": true
  },
  "atlas": {
    "root_hash": "blake3-256:78d2ba98efd19c8a23d3106da1cf1c188edcf3469e54a39ec61e1900dc71ab3a"
  },
  "blockers": [
    "ATLAS_ROOT_UNSEALED: the packaged .atlas is an unsealed census container (no seal gate exists)",
    "COVERAGE_UNKNOWN: CALL",
    "COVERAGE_UNKNOWN: CONCURRENCY",
    "COVERAGE_UNKNOWN: CONTROL_FLOW",
    "COVERAGE_UNKNOWN: DATA_FLOW",
    "COVERAGE_UNKNOWN: EFFECT",
    "COVERAGE_UNKNOWN: OWNERSHIP",
    "COVERAGE_UNKNOWN: PERSISTENCE",
    "COVERAGE_UNKNOWN: STATE",
    "DYNAMIC_DEPENDENCY_OBLIGATIONS: 9",
    "MULTI_ENGINE_RECONCILIATION_ABSENT: one extractor per dimension (Genome: multi_engine_reconciliation_required)",
    "UNKNOWN_FACTS: 712",
    "UNSUPPORTED_FACTS: 228"
  ]
}
