{
  "schema": "atlas.census-certificate.v2",
  "certificate_id": "census-certificate:def5823e36162092f43a66db7a02e28644e7adf5f4c634e60fb77f402c2d8fab",
  "state": "RECONCILED",
  "corpus": {
    "corpus_id": "llgtrn/Atlas-Studio",
    "root_hash": "blake3-256:e0a93857136b197443cd12f66a341701653a11640bba33d1e5c7852ac84564e2",
    "revisions": {
      "llgtrn/Atlas-Studio": "32de9f07131d6a0baf044c698173895ed0734cd6"
    }
  },
  "genome": {
    "schema": "atlas.genome.v1",
    "hash": "blake3-256:e076b0d870969819e6606ab8b3ac21b035635e3d650f2dbcf1989ea2f2c8e4f9"
  },
  "inventory": {
    "artifacts_total": 181,
    "artifacts_accounted_total": 181,
    "closed": true,
    "dispositions": {
      "BINARY_DESCRIBED": 1,
      "IGNORED_BY_EXPLICIT_POLICY": 2,
      "PARSED": 178
    }
  },
  "dependency": {
    "contexts_total": 1,
    "nodes_total": 40,
    "edges_total": 67,
    "source_backed_total": 4,
    "source_censused_total": 4,
    "terminal_boundary_total": 33,
    "unresolved_total": 0,
    "fixed_point_converged": true,
    "closed": true,
    "root_hash": "blake3-256:8585f4e30737c161baa3881b819fa4d5658abc38f20ed07e2505c9c2867ab9f8"
  },
  "semantic": {
    "facts_total": 35316,
    "obligations_total": 3253,
    "obligations_accounted_total": 3253,
    "coverage": {
      "BUILD": "OBSERVED",
      "CALL": "UNKNOWN",
      "CONCURRENCY": "UNKNOWN",
      "CONTROL_FLOW": "UNKNOWN",
      "DATA_FLOW": "UNKNOWN",
      "DECLARED_ADL": "DECLARED",
      "EFFECT": "UNKNOWN",
      "FUNCTION_IDENTITY": "UNKNOWN",
      "FUNCTION_SIGNATURE": "UNKNOWN",
      "OWNERSHIP": "UNKNOWN",
      "PERSISTENCE": "UNKNOWN",
      "RESOURCE": "UNKNOWN",
      "SOURCE_ARTIFACT": "OBSERVED",
      "STATE": "UNKNOWN",
      "SYMBOL": "UNKNOWN",
      "TYPE": "UNKNOWN"
    },
    "unknown_total": 2155,
    "unsupported_total": 430,
    "ignored_total": 2,
    "conflict_total": 0,
    "dynamic_edges_total": 9,
    "binding_gaps_total": 1
  },
  "normalization": {
    "input_records_total": 35316,
    "normalized_records_total": 35316,
    "exact_duplicates_merged": 0,
    "equivalence_classes_total": 35316,
    "conflict_candidates_total": 0,
    "provenance_complete": true,
    "root_hash": "blake3-256:6507dacaca537bc2fcbd082ad3dafaa127dc27758916fdd21f35a8e9faa1b1e2"
  },
  "reconciliation": {
    "complete": true,
    "unresolved_conflicts_total": 0
  },
  "fixed_point": {
    "iterations": 2,
    "converged": true,
    "delta_at_exit": 0
  },
  "independent_passes": {
    "passes_total": 2,
    "agreement": "PARTIAL",
    "conflicts_total": 0
  },
  "evidence": {
    "root_hash": "blake3-256:7b255849fc39cb42e9becb6181ff23f63f361dcb2acc37b62ff739ce985045f1",
    "provenance_complete": true
  },
  "atlas": {
    "root_hash": "blake3-256:4a1e53579ab449ab610fcb0e654646497783a5f05ff8eb5f7c9e589d4011c01b"
  },
  "blockers": [
    "ATLAS_ROOT_UNSEALED: the packaged .atlas is an unsealed census container (no seal gate exists)",
    "COVERAGE_UNKNOWN: CALL",
    "COVERAGE_UNKNOWN: CONCURRENCY",
    "COVERAGE_UNKNOWN: CONTROL_FLOW",
    "COVERAGE_UNKNOWN: DATA_FLOW",
    "COVERAGE_UNKNOWN: EFFECT",
    "COVERAGE_UNKNOWN: FUNCTION_IDENTITY",
    "COVERAGE_UNKNOWN: FUNCTION_SIGNATURE",
    "COVERAGE_UNKNOWN: OWNERSHIP",
    "COVERAGE_UNKNOWN: PERSISTENCE",
    "COVERAGE_UNKNOWN: RESOURCE",
    "COVERAGE_UNKNOWN: STATE",
    "COVERAGE_UNKNOWN: SYMBOL",
    "COVERAGE_UNKNOWN: TYPE",
    "DYNAMIC_DEPENDENCY_OBLIGATIONS: 9",
    "MULTI_ENGINE_RECONCILIATION_ABSENT: one engine for CONTROL_FLOW, DATA_FLOW, FUNCTION_IDENTITY, FUNCTION_SIGNATURE, OWNERSHIP, RESOURCE, STATE, SYMBOL (Genome: multi_engine_reconciliation_required)",
    "UNKNOWN_FACTS: 2155",
    "UNSUPPORTED_FACTS: 430"
  ]
}
