{
  "schema": "atlas.census-certificate.v2",
  "certificate_id": "census-certificate:06fbf0a004b4c37ce260ca276358591e437c22a063989f5e7bbb30ab82b4eb36",
  "state": "RECONCILED",
  "corpus": {
    "corpus_id": "llgtrn/Atlas-Studio",
    "root_hash": "blake3-256:4c5bf32c7741d6d88acb8a15c52fdd5c1084ec2fea5e9e6b1b3fd1e0a53d8787",
    "revisions": {
      "llgtrn/Atlas-Studio": "61af90583a42296a98776b3533089d79d5dbd880"
    }
  },
  "genome": {
    "schema": "atlas.genome.v1",
    "hash": "blake3-256:e076b0d870969819e6606ab8b3ac21b035635e3d650f2dbcf1989ea2f2c8e4f9"
  },
  "inventory": {
    "artifacts_total": 117,
    "artifacts_accounted_total": 117,
    "closed": true,
    "dispositions": {
      "IGNORED_BY_EXPLICIT_POLICY": 2,
      "PARSED": 115
    }
  },
  "dependency": {
    "contexts_total": 1,
    "nodes_total": 27,
    "edges_total": 39,
    "source_backed_total": 4,
    "source_censused_total": 4,
    "terminal_boundary_total": 20,
    "unresolved_total": 0,
    "fixed_point_converged": true,
    "closed": true,
    "root_hash": "blake3-256:5d9cbb00180673c03088c4e705db56aff05aa40c56845265d77ea31c00392742"
  },
  "semantic": {
    "facts_total": 13158,
    "obligations_total": 1572,
    "obligations_accounted_total": 1572,
    "coverage": {
      "BUILD": "OBSERVED",
      "CALL": "UNKNOWN",
      "CONCURRENCY": "UNKNOWN",
      "CONTROL_FLOW": "UNKNOWN",
      "DATA_FLOW": "UNKNOWN",
      "DECLARED_ADL": "DECLARED",
      "EFFECT": "UNKNOWN",
      "FUNCTION_IDENTITY": "OBSERVED",
      "FUNCTION_SIGNATURE": "OBSERVED",
      "OWNERSHIP": "UNKNOWN",
      "PERSISTENCE": "UNKNOWN",
      "SOURCE_ARTIFACT": "OBSERVED",
      "STATE": "UNKNOWN",
      "SYMBOL": "OBSERVED",
      "TYPE": "OBSERVED"
    },
    "unknown_total": 960,
    "unsupported_total": 228,
    "ignored_total": 2,
    "conflict_total": 0,
    "dynamic_edges_total": 9,
    "binding_gaps_total": 1
  },
  "normalization": {
    "input_records_total": 13158,
    "normalized_records_total": 13158,
    "exact_duplicates_merged": 0,
    "equivalence_classes_total": 13158,
    "conflict_candidates_total": 0,
    "provenance_complete": true,
    "root_hash": "blake3-256:108d216d878803ca1d872a39572dcf4efad7adcf065a1714352a61a7914f2b2f"
  },
  "reconciliation": {
    "complete": true,
    "unresolved_conflicts_total": 0
  },
  "fixed_point": {
    "iterations": 2,
    "converged": true,
    "delta_at_exit": 0
  },
  "independent_passes": {
    "passes_total": 2,
    "agreement": "PARTIAL",
    "conflicts_total": 0
  },
  "evidence": {
    "root_hash": "blake3-256:0534b03164fa2f6d3b7afc1e4b8bb65c9f4efc04d219d8d58bdec71cb1e92e6a",
    "provenance_complete": true
  },
  "atlas": {
    "root_hash": "blake3-256:d244c0fc580978b02560bf7a819986be63ae0c56697b5c9b47fa65ffdd567831"
  },
  "blockers": [
    "ATLAS_ROOT_UNSEALED: the packaged .atlas is an unsealed census container (no seal gate exists)",
    "COVERAGE_UNKNOWN: CALL",
    "COVERAGE_UNKNOWN: CONCURRENCY",
    "COVERAGE_UNKNOWN: CONTROL_FLOW",
    "COVERAGE_UNKNOWN: DATA_FLOW",
    "COVERAGE_UNKNOWN: EFFECT",
    "COVERAGE_UNKNOWN: OWNERSHIP",
    "COVERAGE_UNKNOWN: PERSISTENCE",
    "COVERAGE_UNKNOWN: STATE",
    "DYNAMIC_DEPENDENCY_OBLIGATIONS: 9",
    "MULTI_ENGINE_RECONCILIATION_ABSENT: one engine for CONCURRENCY, CONTROL_FLOW, DATA_FLOW, FUNCTION_IDENTITY, FUNCTION_SIGNATURE, OWNERSHIP, PERSISTENCE, STATE, SYMBOL, TYPE (Genome: multi_engine_reconciliation_required)",
    "UNKNOWN_FACTS: 960",
    "UNSUPPORTED_FACTS: 228"
  ]
}
