{
  "schema": "atlas.census-certificate.v2",
  "certificate_id": "census-certificate:58851c5fd84f1c4febec9d2278cae97573c72ddc5ed1cc92f2dc516692c98823",
  "state": "RECONCILED",
  "corpus": {
    "corpus_id": "llgtrn/Atlas-Studio",
    "root_hash": "blake3-256:5d06dde0cc779a086370198ec97f7e2b6ab88acb432cf95ac4f11f2331bef732",
    "revisions": {
      "llgtrn/Atlas-Studio": "4b3819a8d56c01c91079e3f1e2fc7a3243d9e4ac"
    }
  },
  "genome": {
    "schema": "atlas.genome.v1",
    "hash": "blake3-256:e076b0d870969819e6606ab8b3ac21b035635e3d650f2dbcf1989ea2f2c8e4f9"
  },
  "inventory": {
    "artifacts_total": 176,
    "artifacts_accounted_total": 176,
    "closed": true,
    "dispositions": {
      "BINARY_DESCRIBED": 1,
      "IGNORED_BY_EXPLICIT_POLICY": 3,
      "PARSED": 172
    }
  },
  "dependency": {
    "contexts_total": 1,
    "nodes_total": 40,
    "edges_total": 67,
    "source_backed_total": 4,
    "source_censused_total": 4,
    "terminal_boundary_total": 33,
    "unresolved_total": 0,
    "fixed_point_converged": true,
    "closed": true,
    "root_hash": "blake3-256:8585f4e30737c161baa3881b819fa4d5658abc38f20ed07e2505c9c2867ab9f8"
  },
  "semantic": {
    "facts_total": 34094,
    "obligations_total": 3145,
    "obligations_accounted_total": 3145,
    "coverage": {
      "BUILD": "OBSERVED",
      "CALL": "UNKNOWN",
      "CONCURRENCY": "UNKNOWN",
      "CONTROL_FLOW": "UNKNOWN",
      "DATA_FLOW": "UNKNOWN",
      "DECLARED_ADL": "DECLARED",
      "EFFECT": "UNKNOWN",
      "FUNCTION_IDENTITY": "OBSERVED",
      "FUNCTION_SIGNATURE": "OBSERVED",
      "OWNERSHIP": "UNKNOWN",
      "PERSISTENCE": "UNKNOWN",
      "RESOURCE": "UNKNOWN",
      "SOURCE_ARTIFACT": "OBSERVED",
      "STATE": "UNKNOWN",
      "SYMBOL": "OBSERVED",
      "TYPE": "OBSERVED"
    },
    "unknown_total": 2031,
    "unsupported_total": 412,
    "ignored_total": 3,
    "conflict_total": 0,
    "dynamic_edges_total": 9,
    "binding_gaps_total": 1
  },
  "normalization": {
    "input_records_total": 34094,
    "normalized_records_total": 34094,
    "exact_duplicates_merged": 0,
    "equivalence_classes_total": 34094,
    "conflict_candidates_total": 0,
    "provenance_complete": true,
    "root_hash": "blake3-256:9624efff7a663e17629f91345a8e079015ed0c0d7e75cbcf3c20f1e2c2702913"
  },
  "reconciliation": {
    "complete": true,
    "unresolved_conflicts_total": 0
  },
  "fixed_point": {
    "iterations": 2,
    "converged": true,
    "delta_at_exit": 0
  },
  "independent_passes": {
    "passes_total": 2,
    "agreement": "PARTIAL",
    "conflicts_total": 0
  },
  "evidence": {
    "root_hash": "blake3-256:b7e8297f6a51d8ba79e1295edc82686a6037d276c996037b8fe48a4373239b8a",
    "provenance_complete": true
  },
  "atlas": {
    "root_hash": "blake3-256:5cb538f2703f4d0d7847cf2a70b3c0264e10ffb8591b9300c4f2b691dfa5924d"
  },
  "blockers": [
    "ATLAS_ROOT_UNSEALED: the packaged .atlas is an unsealed census container (no seal gate exists)",
    "COVERAGE_UNKNOWN: CALL",
    "COVERAGE_UNKNOWN: CONCURRENCY",
    "COVERAGE_UNKNOWN: CONTROL_FLOW",
    "COVERAGE_UNKNOWN: DATA_FLOW",
    "COVERAGE_UNKNOWN: EFFECT",
    "COVERAGE_UNKNOWN: OWNERSHIP",
    "COVERAGE_UNKNOWN: PERSISTENCE",
    "COVERAGE_UNKNOWN: RESOURCE",
    "COVERAGE_UNKNOWN: STATE",
    "DYNAMIC_DEPENDENCY_OBLIGATIONS: 9",
    "MULTI_ENGINE_RECONCILIATION_ABSENT: one engine for CONTROL_FLOW, DATA_FLOW, FUNCTION_IDENTITY, FUNCTION_SIGNATURE, OWNERSHIP, RESOURCE, STATE, SYMBOL (Genome: multi_engine_reconciliation_required)",
    "UNKNOWN_FACTS: 2031",
    "UNSUPPORTED_FACTS: 412"
  ]
}
